{
  "schemaVersion": "brain.revision-event/1",
  "revisionId": "rev_0001_a",
  "turnId": "turn_0001",
  "producer": "narrator",
  "generation": 3,
  "sequence": 0,
  "status": "provisional",
  "supersedes": null,
  "sourceRefs": [
    "art_weather_summary_v1"
  ],
  "confidence": 0.6,
  "expiresAt": "2026-09-24T18:00:00Z",
  "labels": {
    "integrity": "untrusted_generated",
    "confidentiality": "public"
  }
}
